{
  "job_id": "00000000-0000-4000-8000-000000000002",
  "stage": "06_VISUAL",
  "config_source": "public",
  "config_version": "v1",
  "model": "not_reported",
  "execution_id": "exec-0002",
  "created_at": "2026-10-22T12:00:00Z",
  "insight_id": "ins-0002",
  "evidence_ids": [
    "ev-0003"
  ],
  "grammar_id": "not_reported"
}
