{
  "job_id": "00000000-0000-4000-8000-000000000001",
  "stage": "06_VISUAL",
  "config_source": "public",
  "config_version": "v1",
  "model": "synthetic-model-v0",
  "execution_id": "exec-0001",
  "created_at": "2026-10-22T12:00:00Z",
  "insight_id": "ins-0001",
  "evidence_ids": [
    "ev-0001",
    "ev-0002"
  ],
  "grammar_id": "metrica",
  "rationale": "A single comparison between two verified values reads best as one large number."
}
